Created at	Closed at	Updated at	State	Labels	Comments	Number	Title	Url	Html url	Body	User name	User email	Milestone created at	Milestone due on	Milestone descrtiption	Milestone state	Milestone title
2017-11-15 12:56:24.0	2017-11-28 21:12:07.0	2017-11-29 05:27:33.0	closed	[]	12	488	Fixed Incompatibility with Windows 10	https://api.github.com/repos/torvalds/linux/issues/488	https://github.com/torvalds/linux/pull/488	I was trying to compile the Linux kernel source code on Windows, using this command:    ```  C:\Users\Arnav> python init/main.c # And all other sources  ```    However, I would get an error on the 1st line. Thus, I decided to fix the bugs. Now when I run the code, it works properly. You can thank me now. Now all the Windows 10 users can enjoy the beautiful OS called Linux.    You may think there are indentation issues, but I need them so that MSVC can accept the code.	arnavb	null	null	null	null	null	null	
2017-11-18 19:28:15.0	null	2020-10-02 17:47:00.0	open	[]	2	489	Suggestion for code style fix.	https://api.github.com/repos/torvalds/linux/issues/489	https://github.com/torvalds/linux/pull/489	Adding brackets to show explicitly which else belongs to which if statement.	fmmedeiros	null	null	null	null	null	null	
2017-11-21 14:40:04.0	null	2017-12-22 20:49:12.0	open	[]	3	490	Remove gotos	https://api.github.com/repos/torvalds/linux/issues/490	https://github.com/torvalds/linux/pull/490	I have remove some gotos in functions:    - cap_ptrace_access_check    - cap_ptrace_traceme    This is my first open source project. I would be pleased over feedback.  	christianbender	null	null	null	null	null	null	
2017-11-25 11:51:39.0	2017-11-25 12:08:16.0	2017-11-25 12:08:16.0	closed	[]	1	491	Merge pull request #1 from torvalds/master	https://api.github.com/repos/torvalds/linux/issues/491	https://github.com/torvalds/linux/pull/491	Merge	ghost	null	null	null	null	null	null	
2017-11-25 12:10:21.0	2017-11-25 12:10:34.0	2017-11-25 12:10:34.0	closed	[]	0	492	Merge pull request #1 from torvalds/master	https://api.github.com/repos/torvalds/linux/issues/492	https://github.com/torvalds/linux/pull/492	Merge	ghost	null	null	null	null	null	null	
2017-11-27 13:17:44.0	2018-01-19 14:34:52.0	2018-01-19 14:34:52.0	closed	[]	1	493	x86/tsc: Add kernel parameter to override TSC frequency	https://api.github.com/repos/torvalds/linux/issues/493	https://github.com/torvalds/linux/pull/493	Add kernel parameter tsc_freq= (in KHz) to override TSC frequency returned by native_calibrate_tsc()	Nekotekina	null	null	null	null	null	null	
2017-11-28 15:52:14.0	null	2018-02-16 19:56:19.0	open	[]	1	494	Cleaned Python file to match PEP8 guidelines	https://api.github.com/repos/torvalds/linux/issues/494	https://github.com/torvalds/linux/pull/494	Now, all lines are no longer larger than 78 characters.  Moreover, I moved all comments over a function to their proper docstring.  Finally, I added space between some operators where it was needed.	NicolasBizzozzero	null	null	null	null	null	null	
2017-11-28 18:57:27.0	2018-02-19 12:49:22.0	2018-02-19 12:49:30.0	closed	[]	14	495	this code a lot whole better and verry faster	https://api.github.com/repos/torvalds/linux/issues/495	https://github.com/torvalds/linux/pull/495	It so fast now can run vinux on my shoess, should try put it good, and I got A+++++ on my project in school cuz this very fastly	ghost	null	null	null	null	null	null	
2017-11-30 04:52:45.0	null	2017-11-30 04:58:27.0	open	[]	2	496	Add new QCA Rome Device (04ca:3015)	https://api.github.com/repos/torvalds/linux/issues/496	https://github.com/torvalds/linux/pull/496	Add new QCA Rome Device (04ca:3015), that will allow 04ca:3015 from Lite-on technologies to work properly.	ghost	null	null	null	null	null	null	
2017-12-02 11:04:50.0	null	2020-10-02 17:46:49.0	open	[]	3	497	Adding HID_QUIRK_MULTI_INPUT to a BT HID	https://api.github.com/repos/torvalds/linux/issues/497	https://github.com/torvalds/linux/pull/497	I'm developing a Bluetooth HID emulator (dubbed "across"; http://www.acrosscenter.com) working in a PC or Mac. Across works well with most of client devices whose OS is Windows, macOS, Windows Phone, Android, iOS. Until now I have been thinking Linux would work well like most of other OS's, but it doesn't.  Across packs keyboard, relative coordinate mice, absolute coordinate mice and absolute coordinate touch device into the single interface. However the absolute coordinate touch device prevents input devices enumerator from loading the whole other devices, and it can work around by adding HID_QUIRK_MULTI_INPUT.    PS: I'm developing Across for Linux. :)	SweatingEgg	null	null	null	null	null	null	
2017-12-04 10:54:11.0	2017-12-04 11:17:45.0	2017-12-04 11:32:13.0	closed	[]	1	498	Merge pull request #6 from torvalds/master	https://api.github.com/repos/torvalds/linux/issues/498	https://github.com/torvalds/linux/pull/498	update to rev 4.15-rc1	tmaimon	null	null	null	null	null	null	
2017-12-04 19:29:56.0	null	2020-10-02 17:46:47.0	open	[]	2	499	Added Dell 1537	https://api.github.com/repos/torvalds/linux/issues/499	https://github.com/torvalds/linux/pull/499	Added Dell 1537 Vendor ID 0x19	guylamar2006	null	null	null	null	null	null	
2017-12-12 08:06:19.0	null	2020-10-02 17:46:43.0	open	[]	1	500	Fix description error	https://api.github.com/repos/torvalds/linux/issues/500	https://github.com/torvalds/linux/pull/500	After add support for ds2786 battery gas gauge，the description didn't update. fix it.	elicec	null	null	null	null	null	null	
2017-12-22 23:10:45.0	null	2017-12-22 23:15:07.0	open	[]	1	501	Add grub of bootloader list in INITRD help	https://api.github.com/repos/torvalds/linux/issues/501	https://github.com/torvalds/linux/pull/501	Hello,  Just to add grub in the help list of INITRD in "CONFIG_BLK_DEV_INITRD" section.  Best regards,  Thanks.	tazou	null	null	null	null	null	null	
2018-01-01 11:06:30.0	null	2020-10-02 17:46:38.0	open	[]	1	502	Removed white space	https://api.github.com/repos/torvalds/linux/issues/502	https://github.com/torvalds/linux/pull/502		aslamanver	null	null	null	null	null	null	
2018-01-04 18:59:02.0	2018-01-04 18:59:11.0	2018-01-16 01:06:18.0	closed	[]	2	503	x86: warn if unsecure CPU is being used	https://api.github.com/repos/torvalds/linux/issues/503	https://github.com/torvalds/linux/pull/503	Signed-off-by: Matteo Croce <mcroce@redhat.com>	teknoraver	null	null	null	null	null	null	
2018-01-05 15:49:16.0	2018-01-21 14:43:20.0	2018-01-21 14:43:20.0	closed	[]	5	504	Update common.c	https://api.github.com/repos/torvalds/linux/issues/504	https://github.com/torvalds/linux/pull/504	Update file because AMD actually IS affected by meltdown/spectre attack(s):  https://securityledger.com/2018/01/google-details-cpu-flaws-says-amd-arm-intel-affected/  https://tech.slashdot.org/story/18/01/04/0524234/google-says-almost-all-cpus-since-1995-vulnerable-to-meltdown-and-spectre-flaws  " [...] Spectre affects AMD and ARM as well (and likely other architectures too).   Best I can tell, the only CPUs guaranteed not affected by both are in-order architectures, which many older ARM (and extremely old x86) chips are.  These attacks are a sort of new category of security analysis--realizing that out of order execution can have side effects, and that programs can check for those side effects to leak program state and system memory. "  So yes, it would be safer to just don't touch this modified code - at least we are sure that CPU will be protected in case of any attack.	kspalaiologos	null	null	null	null	null	null	
2018-01-06 08:52:29.0	2019-03-01 16:01:24.0	2019-03-01 16:02:22.0	closed	[]	4	505	fix a bug refer to max_discard is 0	https://api.github.com/repos/torvalds/linux/issues/505	https://github.com/torvalds/linux/pull/505	typically TRIM cost shorter time than ERASE, so we expect max_trim as max_discard. But when ERASE timeout is too long, it did happened actually rather than theoretically.  A type of Toshiba eMMC's ERASE_TIMEOUT_MULT is too long and controller's max_busy_timeout is relatively small, then max_discard could be 0, even max_trim is available, but max_trim < max_disable can't be true, so we get a result of 0 instead of max_trim.	catShit	null	null	null	null	null	null	
2018-01-07 01:32:22.0	2018-01-07 01:40:45.0	2018-01-07 01:40:45.0	closed	[]	1	506	Fixed formating for cipher speed	https://api.github.com/repos/torvalds/linux/issues/506	https://github.com/torvalds/linux/pull/506		da-edra	null	null	null	null	null	null	
2018-01-15 11:15:19.0	2018-01-15 11:19:15.0	2018-01-15 11:19:15.0	closed	[]	1	507	experimental unblock	https://api.github.com/repos/torvalds/linux/issues/507	https://github.com/torvalds/linux/pull/507	Check if the blocking and unblocking works well for creating an effect of   ```perpetual force```	claymodel	null	null	null	null	null	null	
2018-01-17 20:40:01.0	null	2018-02-19 21:51:20.0	open	[]	1	508	[docs] - linux/documentation/abi/readme - minor tweaks [writing]	https://api.github.com/repos/torvalds/linux/issues/508	https://github.com/torvalds/linux/pull/508	###### [docs] - linux/documentation/abi/readme - minor tweaks [writing]	ghost	null	null	null	null	null	null	
2018-01-22 16:28:41.0	null	2020-10-02 17:46:32.0	open	[]	2	509	Sorting error	https://api.github.com/repos/torvalds/linux/issues/509	https://github.com/torvalds/linux/pull/509	Matt Mackal was placed at the top out of order. Recommending a pull to make the document follow the proposed sorting rules Linus intended.	kathryntolsen	null	null	null	null	null	null	
2018-01-22 21:06:12.0	2018-01-22 21:51:53.0	2018-01-22 21:51:53.0	closed	[]	1	510	Fixed several typographic issues for consistency	https://api.github.com/repos/torvalds/linux/issues/510	https://github.com/torvalds/linux/pull/510	For example, add capital letters in the beginning of some sentences, because for all other policy files it is done this way.	debianivanov	null	null	null	null	null	null	
2018-01-22 21:14:52.0	2018-01-22 21:51:25.0	2018-01-22 21:51:25.0	closed	[]	1	511	Fixed 32bit to 32-bit	https://api.github.com/repos/torvalds/linux/issues/511	https://github.com/torvalds/linux/pull/511	Very small change, but I think sufficient : )	debianivanov	null	null	null	null	null	null	
2018-01-24 05:28:22.0	2018-01-24 05:28:52.0	2018-01-24 05:28:52.0	closed	[]	0	512	Merge pull request #1 from torvalds/master	https://api.github.com/repos/torvalds/linux/issues/512	https://github.com/torvalds/linux/pull/512	Syncing from original	hellozee	null	null	null	null	null	null	
2018-01-29 13:39:45.0	2018-01-29 13:40:07.0	2018-01-29 13:40:07.0	closed	[]	0	513	Update from Base	https://api.github.com/repos/torvalds/linux/issues/513	https://github.com/torvalds/linux/pull/513		Esteban-Rocha	null	null	null	null	null	null	
2018-01-31 01:06:02.0	2018-01-31 01:06:51.0	2018-01-31 01:09:21.0	closed	[]	0	514	Update README	https://api.github.com/repos/torvalds/linux/issues/514	https://github.com/torvalds/linux/pull/514		pbobyn91	null	null	null	null	null	null	
2018-02-05 08:01:44.0	2018-02-06 03:15:57.0	2018-02-09 12:57:12.0	closed	[]	5	515	Updates calculation of wTotalLength for UAC2 gadget USB descriptor	https://api.github.com/repos/torvalds/linux/issues/515	https://github.com/torvalds/linux/pull/515	According to specification (http://www.usb.org/developers/docs/devclass_docs/audio10.pdf, page 38), the descriptor header size should be included in wTotalLength. This **should** fix problem with UAC2 gadgets not getting recognized in Windows 10.	robiwano	null	null	null	null	null	null	
2018-02-08 09:13:15.0	null	2020-10-02 17:46:28.0	open	[]	1	516	EM-2040 i2c fixes DO NOT MERGE	https://api.github.com/repos/torvalds/linux/issues/516	https://github.com/torvalds/linux/pull/516	For early RFC/review purposes only!	oliv3r	null	null	null	null	null	null	
2018-02-12 04:44:46.0	null	2020-10-02 17:46:26.0	open	[]	1	517	Syntax consistency update when declaring variables	https://api.github.com/repos/torvalds/linux/issues/517	https://github.com/torvalds/linux/pull/517	Changing the basic variable declarations to be more consistent through out the file.	damienfamed75	null	null	null	null	null	null	
2018-02-14 17:09:58.0	null	2020-10-02 17:46:24.0	open	[]	1	518	x86: Treat R_X86_64_PLT32 as R_X86_64_PC32	https://api.github.com/repos/torvalds/linux/issues/518	https://github.com/torvalds/linux/pull/518	On i386, there are 2 types of PLTs, PIC and non-PIC.  PIE and shared  objects must use PIC PLT.  To use PIC PLT, you need to load  _GLOBAL_OFFSET_TABLE_ into EBX first.  There is no need for that on  x86-64 since x86-64 uses PC-relative PLT.    On x86-64, for 32-bit PC-relative branches, we can generate PLT32  relocation, instead of PC32 relocation, which can also be used as  a marker for 32-bit PC-relative branches.  Linker can always reduce  PLT32 relocation to PC32 if function is defined locally.   Local  functions should use PC32 relocation.  As far as Linux kernel is  concerned, R_X86_64_PLT32 can be treated the same as R_X86_64_PC32  since Linux kernel doesn't use PLT.    R_X86_64_PLT32 for 32-bit PC-relative branches has been enabled in  binutils master branch which will become binutils 2.31.    Tested with    commit 61f14c015f5be9151ba25e638d349f4d40cb7cd4  Merge: 178e834c47b0 791412dafbbf  Author: Linus Torvalds <torvalds@linux-foundation.org>  Date:   Tue Feb 13 09:35:17 2018 -0800        Merge tag 'mips_4.16_2' of git://git.kernel.org/pub/scm/linux/kernel/git/jhogan/mips    on x86-64, using binutils master branch:    commit 692d6f9760bc67b68a5c96baac47067fd7dfa711  Author: Tom Tromey <tom@tromey.com>  Date:   Tue Feb 13 13:34:45 2018 -0700        Constify target_so_ops::bfd_open    Signed-off-by: H.J. Lu <hjl.tools@gmail.com>	hjl-tools	null	null	null	null	null	null	
2018-02-15 09:39:18.0	null	2019-02-26 11:24:57.0	open	[]	5	519	USB: serial: cp210x: add new device EZP2010	https://api.github.com/repos/torvalds/linux/issues/519	https://github.com/torvalds/linux/pull/519	EZP2010 is a very popular Chinese USB SPI Programmer. Manufacturer provides only windows drivers, but this device is based on Silicon Labs CP210x chip, so it is not so hard to add it to the driver id table.	klukonin	null	null	null	null	null	null	
2018-02-16 21:16:07.0	null	2018-02-16 21:20:09.0	open	[]	1	520	driver/base: Refactor	https://api.github.com/repos/torvalds/linux/issues/520	https://github.com/torvalds/linux/pull/520		243083df	null	null	null	null	null	null	
2018-02-19 09:04:56.0	2018-02-19 09:07:38.0	2018-02-19 09:07:38.0	closed	[]	2	521	Jailhouse enabling/4.14	https://api.github.com/repos/torvalds/linux/issues/521	https://github.com/torvalds/linux/pull/521		anilkuamr	null	null	null	null	null	null	
2018-02-22 20:09:11.0	2018-05-26 14:20:30.0	2018-05-26 14:20:38.0	closed	[]	1	522	ALSA: usb: add quirk for Singxer F-1 DSD converter	https://api.github.com/repos/torvalds/linux/issues/522	https://github.com/torvalds/linux/pull/522	This patch adds native DSD support for the Singxer F-1 converter board.	patrickschaffrath	null	null	null	null	null	null	
2018-02-27 16:31:00.0	null	2020-10-02 17:46:17.0	open	[]	1	524	For better readability updated xz.txt file	https://api.github.com/repos/torvalds/linux/issues/524	https://github.com/torvalds/linux/pull/524	Updated xz.txt file to remove two conservative colons.  Example:: changed to Example:	mshingote	null	null	null	null	null	null	
2018-03-02 12:16:44.0	2018-03-03 07:00:10.0	2018-04-07 03:31:22.0	closed	[]	1	525	Wip syscall	https://api.github.com/repos/torvalds/linux/issues/525	https://github.com/torvalds/linux/pull/525		goswami-rahul	null	null	null	null	null	null	
2018-03-04 20:00:32.0	2018-03-04 20:01:01.0	2018-03-04 20:01:01.0	closed	[]	0	527	Documentation: teaching: labs: introduction: Fix typos	https://api.github.com/repos/torvalds/linux/issues/527	https://github.com/torvalds/linux/pull/527		andadrn	null	null	null	null	null	null	
2018-03-05 15:28:45.0	null	2020-10-02 17:46:15.0	open	[]	4	528	A question about your kernel 4.12.1	https://api.github.com/repos/torvalds/linux/issues/528	https://github.com/torvalds/linux/pull/528	Hello,    is your kernel compatible/usable with UP Squared also?    Thanks in advance,  Michael  	mickpf	null	null	null	null	null	null	
2018-03-07 03:19:33.0	2018-03-07 03:33:06.0	2018-03-19 10:29:44.0	closed	[]	4	529	test github	https://api.github.com/repos/torvalds/linux/issues/529	https://github.com/torvalds/linux/pull/529		h0n3ym4k	null	null	null	null	null	null	
2018-03-10 07:05:14.0	2018-03-10 09:21:31.0	2018-03-12 02:52:51.0	closed	[]	2	530	fix a typo in devicetree bindings.	https://api.github.com/repos/torvalds/linux/issues/530	https://github.com/torvalds/linux/pull/530		youxiaojie	null	null	null	null	null	null	
2018-03-10 16:10:55.0	2018-03-10 16:14:06.0	2018-03-19 10:28:37.0	closed	[]	1	531	SYSCALL	https://api.github.com/repos/torvalds/linux/issues/531	https://github.com/torvalds/linux/pull/531		dblackmorris	null	null	null	null	null	null	
2018-03-12 20:54:50.0	2018-03-12 20:55:22.0	2018-03-13 03:46:40.0	closed	[]	3	532	Documentation: lectures: Add draft 'Interrupts' lecture	https://api.github.com/repos/torvalds/linux/issues/532	https://github.com/torvalds/linux/pull/532	Addressed Tavi's comments. Still TODO: add info about IPI, add slide about IRQ handling in Linux (irq chips etc).	dbaluta	null	null	null	null	null	null	
2018-03-14 21:37:35.0	2018-03-14 21:39:24.0	2018-03-14 21:39:24.0	closed	[]	0	533	asdf	https://api.github.com/repos/torvalds/linux/issues/533	https://github.com/torvalds/linux/pull/533		smohebbi	null	null	null	null	null	null	
2018-03-17 10:15:17.0	2018-04-07 03:31:22.0	2018-04-07 03:31:22.0	closed	[]	1	534	9 bit uart	https://api.github.com/repos/torvalds/linux/issues/534	https://github.com/torvalds/linux/pull/534	is there any serialdriver to get 9 bit uart data  	vsivanagulu	null	null	null	null	null	null	
2018-03-18 20:58:32.0	2018-03-18 21:00:57.0	2018-03-18 21:00:57.0	closed	[]	1	535	lab04: exercises: fixed access variable reset 	https://api.github.com/repos/torvalds/linux/issues/535	https://github.com/torvalds/linux/pull/535	atomic_inc will not reset the access variable, and so, the resource will be busy at any second call. To solve, atomic_dec, or simply, atomic_set to 0, as implied in the TODO.	crmares	null	null	null	null	null	null	
2018-03-20 16:55:23.0	2018-03-20 16:57:44.0	2018-03-20 16:58:41.0	closed	[]	0	536	Fixed typo in time.c	https://api.github.com/repos/torvalds/linux/issues/536	https://github.com/torvalds/linux/pull/536	Randomly stumbled upon this:  LINE 184: "Verify we're witin" -> "Verify we're within"    //EDIT: Not the appropriate location for something like this	drewgrubb0	null	null	null	null	null	null	
2018-03-22 20:51:55.0	null	2020-10-02 17:46:12.0	open	[]	1	537	Fix misspelling: must not	https://api.github.com/repos/torvalds/linux/issues/537	https://github.com/torvalds/linux/pull/537	Signed-off-by: Piotr Kasprzyk <ciri@ciri.pl>	kwadrat	null	null	null	null	null	null	
2018-03-28 01:40:36.0	2018-03-28 01:42:13.0	2018-03-28 01:42:13.0	closed	[]	0	538	Aosp optee 4.9	https://api.github.com/repos/torvalds/linux/issues/538	https://github.com/torvalds/linux/pull/538		jsaxer	null	null	null	null	null	null	
2018-03-30 01:50:44.0	2018-03-30 01:51:51.0	2018-03-30 01:51:51.0	closed	[]	1	539	update	https://api.github.com/repos/torvalds/linux/issues/539	https://github.com/torvalds/linux/pull/539	update	chaosmamama	null	null	null	null	null	null	
2018-03-30 07:53:27.0	2019-03-21 08:22:10.0	2019-03-21 08:22:11.0	closed	[]	1	540	Add new FITRIM ioctl for fstrim to trim FAT file system	https://api.github.com/repos/torvalds/linux/issues/540	https://github.com/torvalds/linux/pull/540	FAT file system lacks the ability to handle FITRIM ioctl, thus we can not use fstrim one FAT filesys.  This change add FITRIM ioctl for fstrim or other tools to leverage.	witallwang	null	null	null	null	null	null	
2018-04-02 20:13:59.0	null	2020-10-02 17:46:09.0	open	[]	1	541	Proposal integration FN+F9 for KeyboardBacklight	https://api.github.com/repos/torvalds/linux/issues/541	https://github.com/torvalds/linux/pull/541	when trying to turn on the keyboard light FN+F9  ''' [  775.626810] acer_wmi: Unknown key number - 0x84 '''	webghostx	null	null	null	null	null	null	
2018-04-04 07:00:48.0	2018-04-04 07:01:17.0	2018-04-04 07:01:17.0	closed	[]	0	542	Merge pull request #1 from torvalds/master	https://api.github.com/repos/torvalds/linux/issues/542	https://github.com/torvalds/linux/pull/542	update	rahrawat	null	null	null	null	null	null	
2018-04-04 18:24:22.0	2018-04-04 18:25:26.0	2018-04-04 18:25:26.0	closed	[]	1	543	Update from base	https://api.github.com/repos/torvalds/linux/issues/543	https://github.com/torvalds/linux/pull/543		Esteban-Rocha	null	null	null	null	null	null	
2018-04-05 09:31:06.0	2018-04-07 03:31:22.0	2018-04-07 03:31:22.0	closed	[]	1	544	Added sisusb for USB2VGA	https://api.github.com/repos/torvalds/linux/issues/544	https://github.com/torvalds/linux/pull/544	Specifically for the Magic Control Technology Corp. Magic Control Technology Corp. dongle.	teaberryy	null	null	null	null	null	null	
2018-04-06 13:38:28.0	2018-04-06 13:39:02.0	2018-04-06 13:44:15.0	closed	[]	1	545	[DELETE ME] PR on wrong repo, sorry.	https://api.github.com/repos/torvalds/linux/issues/545	https://github.com/torvalds/linux/pull/545	PR on wrong repo, sorry.	oliv3r	null	null	null	null	null	null	
2018-04-06 15:17:11.0	null	2020-10-02 17:46:06.0	open	[]	2	546	Removed the non working back-quotes from README.md  around make	https://api.github.com/repos/torvalds/linux/issues/546	https://github.com/torvalds/linux/pull/546	For some reason _make htmldocs_ is not changing into `make htmldocs` in README.md even after trying in multiple ways. So just removed the back quotes which were serving no use.	ShivajiReddy	null	null	null	null	null	null	
2018-04-06 23:03:32.0	2018-04-06 23:21:07.0	2018-04-06 23:21:07.0	closed	[]	2	547	DeleteMe Please	https://api.github.com/repos/torvalds/linux/issues/547	https://github.com/torvalds/linux/pull/547		FelipeRuizGarcia	null	null	null	null	null	null	
2018-04-08 11:09:06.0	null	2020-10-02 17:46:05.0	open	[]	2	548	Add kernal module meta-data	https://api.github.com/repos/torvalds/linux/issues/548	https://github.com/torvalds/linux/pull/548	Some software like firewalld depend on kernel module meta-data.  This patch will help to fix: https://github.com/firewalld/firewalld/issues/263	kvishnivetsky	null	null	null	null	null	null	
2018-04-08 14:10:33.0	null	2020-10-02 17:46:03.0	open	[]	10	549	Deleted commas in json file	https://api.github.com/repos/torvalds/linux/issues/549	https://github.com/torvalds/linux/pull/549	I deleted the commas that where right after the open curly brackets, because there wasn't anything in front of the commas.	Audition-CSBlock	null	null	null	null	null	null	
2018-04-23 04:44:35.0	2018-04-23 14:10:13.0	2018-04-23 14:10:58.0	closed	[]	1	550	Update skbuff.c	https://api.github.com/repos/torvalds/linux/issues/550	https://github.com/torvalds/linux/pull/550		compdzwio	null	null	null	null	null	null	
2018-04-23 14:29:44.0	2018-04-23 14:31:42.0	2018-04-23 14:31:42.0	closed	[]	1	551	easy understand	https://api.github.com/repos/torvalds/linux/issues/551	https://github.com/torvalds/linux/pull/551		compdzwio	null	null	null	null	null	null	
2018-05-07 04:35:04.0	null	2020-10-02 17:45:56.0	open	[]	1	552	Update timekeeping.h	https://api.github.com/repos/torvalds/linux/issues/552	https://github.com/torvalds/linux/pull/552	typo CLOCK_MONTONIC	jjnetcn	null	null	null	null	null	null	
2018-05-12 20:20:40.0	2018-05-15 10:04:37.0	2018-05-18 02:50:38.0	closed	[]	3	553	Renamed README to README.md for Markdown support.	https://api.github.com/repos/torvalds/linux/issues/553	https://github.com/torvalds/linux/pull/553		Dogacel	null	null	null	null	null	null	
2018-05-28 02:45:03.0	null	2020-10-02 17:45:51.0	open	[]	2	554	ideapad-laptop: Add E42-80 to no_hw_rfkill list	https://api.github.com/repos/torvalds/linux/issues/554	https://github.com/torvalds/linux/pull/554	`Lenovo Zhaoyang E42-80` is another Lenovo ideapad model **without a hw rfkill switch**, resulting in wifi always reported as hard blocked.  Add it to the list of models without rfkill switch.	dylanchu	null	null	null	null	null	null	
2018-05-29 14:23:39.0	2018-05-29 14:32:18.0	2018-05-29 14:36:32.0	closed	[]	1	555	.	https://api.github.com/repos/torvalds/linux/issues/555	https://github.com/torvalds/linux/pull/555	upstream	0x726f6b6d	null	null	null	null	null	null	
2018-05-30 12:16:40.0	2018-05-30 12:31:31.0	2018-05-30 12:31:31.0	closed	[]	1	556	Merge pull request #1 from torvalds/master	https://api.github.com/repos/torvalds/linux/issues/556	https://github.com/torvalds/linux/pull/556	update upstream	rsy56640	null	null	null	null	null	null	
2018-06-03 14:48:14.0	null	2020-10-02 17:45:49.0	open	[]	1	557	[GitHub][docs] Rename README to README.md [markdown]	https://api.github.com/repos/torvalds/linux/issues/557	https://github.com/torvalds/linux/pull/557	Clearly this is a markdown file with markdown grammar. And change the filename extension can make GitHub give a better display.	Leo-Mu	null	null	null	null	null	null	
2018-06-05 09:42:15.0	null	2020-10-02 17:45:47.0	open	[]	4	558	Optimization	https://api.github.com/repos/torvalds/linux/issues/558	https://github.com/torvalds/linux/pull/558		ArtemOSDev	null	null	null	null	null	null	
2018-06-06 03:54:07.0	2018-06-19 07:44:06.0	2018-06-19 07:44:06.0	closed	[]	3	559	Merge pull request #1 from torvalds/master	https://api.github.com/repos/torvalds/linux/issues/559	https://github.com/torvalds/linux/pull/559	update	haobinnan	null	null	null	null	null	null	
2018-06-09 02:16:22.0	2018-06-09 02:16:40.0	2018-06-09 02:16:40.0	closed	[]	0	560	update upstream #1 from torvalds/master	https://api.github.com/repos/torvalds/linux/issues/560	https://github.com/torvalds/linux/pull/560	update upstream	rsy56640	null	null	null	null	null	null	
